{
  "$schema": "https://json-schema.org/draft/2020-12/schema",
  "$id": "model-registry.schema.json",
  "title": "Aerovia model registry",
  "description": "Contract model-registry 1.0.0: data/models/registry.json, written by data-pipeline/aerovia_pipeline/surrogate_export.py: one entry per (method, network) with the checkpoint and ONNX file identities, the input and output tensors, the calibrated signature, parity against ONNX Runtime and the training receipt; the diagnostic checkpoints and the implementation digests at export. Read by frontend/src/learned/index.ts and surrogate_validate.py; the model-io contract is checked against it.",
  "type": "object",
  "additionalProperties": false,
  "required": [
    "schema",
    "version",
    "createdAt",
    "sourceSha256",
    "featureSchema",
    "entries",
    "diagnosticCheckpoints",
    "implementationAtExport",
    "domain",
    "postprocessing"
  ],
  "properties": {
    "schema": {
      "const": "aerovia.model-registry/v1"
    },
    "version": {
      "type": "string",
      "pattern": "^\\d+\\.\\d+\\.\\d+$"
    },
    "createdAt": {
      "type": "string",
      "pattern": "^\\d{4}-\\d{2}-\\d{2}T\\d{2}:\\d{2}:\\d{2}(\\.\\d{1,3})?Z$"
    },
    "sourceSha256": {
      "type": "string",
      "pattern": "^[0-9a-f]{64}$"
    },
    "featureSchema": {
      "type": "string",
      "minLength": 1
    },
    "entries": {
      "type": "array",
      "items": {
        "type": "object",
        "additionalProperties": false,
        "required": [
          "methodId",
          "networkId",
          "version",
          "license",
          "status",
          "lane",
          "physicalSha256",
          "sourceSha256",
          "checkpoint",
          "onnx",
          "input",
          "outputs",
          "outputSpeed",
          "factorBounds",
          "speedBounds",
          "baseResistances",
          "signature",
          "onnxParity",
          "trainingSeed",
          "bestEpoch",
          "validationLoss",
          "architecture",
          "trainingCaseIds"
        ],
        "properties": {
          "methodId": {
            "type": "string",
            "enum": [
              "graph-surrogate",
              "topology-mlp"
            ]
          },
          "networkId": {
            "type": "string",
            "minLength": 1
          },
          "version": {
            "type": "string",
            "pattern": "^\\d+\\.\\d+\\.\\d+$"
          },
          "license": {
            "type": "string",
            "minLength": 1
          },
          "status": {
            "type": "string",
            "enum": [
              "implemented"
            ]
          },
          "lane": {
            "type": "string",
            "enum": [
              "offline-and-onnx"
            ]
          },
          "physicalSha256": {
            "type": "string",
            "pattern": "^[0-9a-f]{64}$"
          },
          "sourceSha256": {
            "type": "string",
            "pattern": "^[0-9a-f]{64}$"
          },
          "checkpoint": {
            "$ref": "#/$defs/fileIdentity"
          },
          "onnx": {
            "$ref": "#/$defs/fileIdentity"
          },
          "input": {
            "type": "object",
            "additionalProperties": false,
            "required": [
              "name",
              "dtype",
              "shape"
            ],
            "properties": {
              "name": {
                "const": "logResistanceRatios"
              },
              "dtype": {
                "const": "float32"
              },
              "shape": {
                "type": "array",
                "prefixItems": [
                  {
                    "const": "batch"
                  },
                  {
                    "type": "integer",
                    "minimum": 1
                  }
                ],
                "minItems": 2,
                "maxItems": 2,
                "items": false,
                "description": "The batch axis, then one log resistance ratio per branch."
              }
            }
          },
          "outputs": {
            "type": "array",
            "prefixItems": [
              {
                "const": "rawFlows"
              },
              {
                "const": "flows"
              },
              {
                "const": "pressures"
              }
            ],
            "minItems": 3,
            "maxItems": 3,
            "items": false,
            "description": "The ONNX output tensors in graph order; flows and rawFlows are per branch, pressures per node."
          },
          "outputSpeed": {
            "type": "integer",
            "minimum": 0
          },
          "factorBounds": {
            "type": "array",
            "items": {
              "type": "number"
            },
            "minItems": 2,
            "maxItems": 2
          },
          "speedBounds": {
            "type": "array",
            "items": {
              "type": "number"
            },
            "minItems": 2,
            "maxItems": 2
          },
          "baseResistances": {
            "type": "array",
            "items": {
              "type": "number"
            }
          },
          "signature": {
            "type": "object",
            "additionalProperties": false,
            "required": [
              "nodeIds",
              "boundaries",
              "edgeIds",
              "from",
              "to",
              "kinds",
              "fanPressure",
              "fanCoefficient",
              "fanEfficiency"
            ],
            "properties": {
              "nodeIds": {
                "type": "array",
                "items": {
                  "type": "string",
                  "minLength": 1
                }
              },
              "boundaries": {
                "type": "array",
                "items": {
                  "anyOf": [
                    {
                      "type": "null"
                    },
                    {
                      "type": "number"
                    }
                  ]
                }
              },
              "edgeIds": {
                "type": "array",
                "items": {
                  "type": "string",
                  "minLength": 1
                }
              },
              "from": {
                "type": "array",
                "items": {
                  "type": "string",
                  "minLength": 1
                }
              },
              "to": {
                "type": "array",
                "items": {
                  "type": "string",
                  "minLength": 1
                }
              },
              "kinds": {
                "type": "array",
                "items": {
                  "type": "string",
                  "minLength": 1
                }
              },
              "fanPressure": {
                "type": "array",
                "items": {
                  "type": "number",
                  "minimum": 0
                }
              },
              "fanCoefficient": {
                "type": "array",
                "items": {
                  "type": "number"
                }
              },
              "fanEfficiency": {
                "type": "array",
                "items": {
                  "type": "number"
                }
              }
            },
            "description": "The physical topology the model was calibrated on, one array entry per node or per branch; length = the input width or the pressures width."
          },
          "onnxParity": {
            "type": "object",
            "additionalProperties": false,
            "required": [
              "samples",
              "rawFlowMaxAbs",
              "flowMaxAbs",
              "pressureMaxAbs",
              "flowTolerance",
              "pressureTolerance",
              "runtime",
              "singleSamplePassed"
            ],
            "properties": {
              "samples": {
                "type": "integer",
                "minimum": 0
              },
              "rawFlowMaxAbs": {
                "type": "number",
                "minimum": 0
              },
              "flowMaxAbs": {
                "type": "number",
                "minimum": 0
              },
              "pressureMaxAbs": {
                "type": "number",
                "minimum": 0
              },
              "flowTolerance": {
                "type": "number"
              },
              "pressureTolerance": {
                "type": "number"
              },
              "runtime": {
                "type": "string",
                "minLength": 1
              },
              "singleSamplePassed": {
                "type": "boolean"
              }
            }
          },
          "trainingSeed": {
            "type": "integer",
            "minimum": 0
          },
          "bestEpoch": {
            "type": "integer",
            "minimum": 0
          },
          "validationLoss": {
            "type": "number",
            "minimum": 0
          },
          "architecture": {
            "type": "object",
            "additionalProperties": false,
            "required": [
              "hidden",
              "steps"
            ],
            "properties": {
              "hidden": {
                "type": "integer",
                "minimum": 0
              },
              "steps": {
                "type": "integer",
                "minimum": 0
              }
            }
          },
          "trainingCaseIds": {
            "type": "array",
            "items": {
              "type": "string",
              "minLength": 1
            },
            "minItems": 1
          }
        }
      },
      "minItems": 1
    },
    "diagnosticCheckpoints": {
      "type": "array",
      "items": {
        "type": "object",
        "additionalProperties": false,
        "required": [
          "id",
          "file",
          "sha256",
          "bytes",
          "trainingCaseIds",
          "lane"
        ],
        "properties": {
          "id": {
            "type": "string",
            "minLength": 1
          },
          "file": {
            "type": "string",
            "minLength": 1
          },
          "sha256": {
            "type": "string",
            "pattern": "^[0-9a-f]{64}$"
          },
          "bytes": {
            "type": "integer",
            "minimum": 0
          },
          "trainingCaseIds": {
            "type": "array",
            "items": {
              "type": "string",
              "minLength": 1
            }
          },
          "lane": {
            "type": "string",
            "minLength": 1
          }
        }
      }
    },
    "implementationAtExport": {
      "type": "object",
      "additionalProperties": {
        "type": "object",
        "additionalProperties": false,
        "required": [
          "sha256",
          "bytes"
        ],
        "properties": {
          "sha256": {
            "type": "string",
            "pattern": "^[0-9a-f]{64}$"
          },
          "bytes": {
            "type": "integer",
            "minimum": 0
          }
        }
      }
    },
    "domain": {
      "type": "string",
      "minLength": 1
    },
    "postprocessing": {
      "type": "string",
      "minLength": 1
    }
  },
  "$defs": {
    "fileIdentity": {
      "type": "object",
      "additionalProperties": false,
      "required": [
        "file",
        "sha256",
        "bytes"
      ],
      "properties": {
        "file": {
          "type": "string",
          "minLength": 1
        },
        "sha256": {
          "type": "string",
          "pattern": "^[0-9a-f]{64}$"
        },
        "bytes": {
          "type": "integer",
          "minimum": 1
        }
      }
    }
  }
}
