{
  "schema": "aerovia.model-registry/v1",
  "version": "1.0.0",
  "createdAt": "2026-09-10T03:48:15Z",
  "sourceSha256": "205668688c71f57d4b357da8572c3fc0f45dc2ba4c3d0a1ecccd4453d7da13e5",
  "featureSchema": "aerovia.resistance-log-ratios/v1",
  "entries": [
    {
      "methodId": "topology-mlp",
      "networkId": "room-pillar",
      "version": "1.0.0",
      "license": "Apache-2.0",
      "status": "implemented",
      "lane": "offline-and-onnx",
      "physicalSha256": "89aeb38e61835c1b858c0e1d0d671d0c5c1d9e7a86e796839344b9b62456c371",
      "sourceSha256": "205668688c71f57d4b357da8572c3fc0f45dc2ba4c3d0a1ecccd4453d7da13e5",
      "checkpoint": {
        "file": "topology-mlp/room-pillar.pt",
        "sha256": "72819c2c68b8d586e9d37267fe8fd3d7fdd6cc6988722b923080c5dafb18c62d",
        "bytes": 3489
      },
      "onnx": {
        "file": "topology-mlp/room-pillar.onnx",
        "sha256": "4a8bc0dcd4cdf3af0420110cffc00813db379ee0a361ce02127a7d4570d4d6fb",
        "bytes": 4997
      },
      "input": {
        "name": "logResistanceRatios",
        "dtype": "float32",
        "shape": [
          "batch",
          42
        ]
      },
      "outputs": [
        "rawFlows",
        "flows",
        "pressures"
      ],
      "outputSpeed": 1,
      "factorBounds": [
        0.35,
        5.8
      ],
      "speedBounds": [
        0.0,
        1.5
      ],
      "baseResistances": [
        0.045,
        0.03,
        0.12,
        0.16,
        0.12,
        9.0,
        0.12,
        9.0,
        0.12,
        0.23500000000000001,
        0.26,
        0.16,
        0.16,
        0.16,
        9.0,
        0.16,
        9.0,
        0.16,
        0.23500000000000001,
        0.26,
        0.2,
        0.16,
        0.2,
        9.0,
        0.2,
        9.0,
        1.3,
        0.23500000000000001,
        0.26,
        0.24,
        0.16,
        0.24,
        0.185,
        0.24,
        0.21000000000000002,
        1.5,
        0.23500000000000001,
        0.26,
        0.28,
        0.28,
        0.28,
        1.7000000000000002
      ],
      "signature": {
        "nodeIds": [
          "atmosphere-in",
          "atmosphere-out",
          "r0c0",
          "r0c1",
          "r0c2",
          "r0c3",
          "r0c4",
          "r1c0",
          "r1c1",
          "r1c2",
          "r1c3",
          "r1c4",
          "r2c0",
          "r2c1",
          "r2c2",
          "r2c3",
          "r2c4",
          "r3c0",
          "r3c1",
          "r3c2",
          "r3c3",
          "r3c4",
          "r4c0",
          "r4c1",
          "r4c2",
          "r4c3",
          "r4c4"
        ],
        "boundaries": [
          0,
          0,
          null,
          null,
          null,
          null,
          null,
          null,
          null,
          null,
          null,
          null,
          null,
          null,
          null,
          null,
          null,
          null,
          null,
          null,
          null,
          null,
          null,
          null,
          null,
          null,
          null
        ],
        "edgeIds": [
          "decline-intake",
          "district-fan",
          "east-0-0",
          "north-0-0",
          "east-0-1",
          "north-0-1",
          "east-0-2",
          "north-0-2",
          "east-0-3",
          "north-0-3",
          "north-0-4",
          "east-1-0",
          "north-1-0",
          "east-1-1",
          "north-1-1",
          "east-1-2",
          "north-1-2",
          "east-1-3",
          "north-1-3",
          "north-1-4",
          "east-2-0",
          "north-2-0",
          "east-2-1",
          "north-2-1",
          "east-2-2",
          "north-2-2",
          "east-2-3",
          "north-2-3",
          "north-2-4",
          "east-3-0",
          "north-3-0",
          "east-3-1",
          "north-3-1",
          "east-3-2",
          "north-3-2",
          "east-3-3",
          "north-3-3",
          "north-3-4",
          "east-4-0",
          "east-4-1",
          "east-4-2",
          "east-4-3"
        ],
        "from": [
          "atmosphere-in",
          "r4c4",
          "r0c0",
          "r0c0",
          "r0c1",
          "r0c1",
          "r0c2",
          "r0c2",
          "r0c3",
          "r0c3",
          "r0c4",
          "r1c0",
          "r1c0",
          "r1c1",
          "r1c1",
          "r1c2",
          "r1c2",
          "r1c3",
          "r1c3",
          "r1c4",
          "r2c0",
          "r2c0",
          "r2c1",
          "r2c1",
          "r2c2",
          "r2c2",
          "r2c3",
          "r2c3",
          "r2c4",
          "r3c0",
          "r3c0",
          "r3c1",
          "r3c1",
          "r3c2",
          "r3c2",
          "r3c3",
          "r3c3",
          "r3c4",
          "r4c0",
          "r4c1",
          "r4c2",
          "r4c3"
        ],
        "to": [
          "r0c0",
          "atmosphere-out",
          "r0c1",
          "r1c0",
          "r0c2",
          "r1c1",
          "r0c3",
          "r1c2",
          "r0c4",
          "r1c3",
          "r1c4",
          "r1c1",
          "r2c0",
          "r1c2",
          "r2c1",
          "r1c3",
          "r2c2",
          "r1c4",
          "r2c3",
          "r2c4",
          "r2c1",
          "r3c0",
          "r2c2",
          "r3c1",
          "r2c3",
          "r3c2",
          "r2c4",
          "r3c3",
          "r3c4",
          "r3c1",
          "r4c0",
          "r3c2",
          "r4c1",
          "r3c3",
          "r4c2",
          "r3c4",
          "r4c3",
          "r4c4",
          "r4c1",
          "r4c2",
          "r4c3",
          "r4c4"
        ],
        "kinds": [
          "intake",
          "fan",
          "intake",
          "return",
          "intake",
          "crosscut",
          "intake",
          "crosscut",
          "intake",
          "return",
          "return",
          "intake",
          "return",
          "intake",
          "crosscut",
          "intake",
          "crosscut",
          "intake",
          "return",
          "return",
          "intake",
          "return",
          "intake",
          "crosscut",
          "intake",
          "crosscut",
          "working",
          "return",
          "return",
          "intake",
          "return",
          "intake",
          "return",
          "intake",
          "return",
          "working",
          "return",
          "return",
          "intake",
          "intake",
          "intake",
          "working"
        ],
        "fanPressure": [
          0,
          2700,
          0,
          0,
          0,
          0,
          0,
          0,
          0,
          0,
          0,
          0,
          0,
          0,
          0,
          0,
          0,
          0,
          0,
          0,
          0,
          0,
          0,
          0,
          0,
          0,
          0,
          0,
          0,
          0,
          0,
          0,
          0,
          0,
          0,
          0,
          0,
          0,
          0,
          0,
          0,
          0
        ],
        "fanCoefficient": [
          0,
          0.012,
          0,
          0,
          0,
          0,
          0,
          0,
          0,
          0,
          0,
          0,
          0,
          0,
          0,
          0,
          0,
          0,
          0,
          0,
          0,
          0,
          0,
          0,
          0,
          0,
          0,
          0,
          0,
          0,
          0,
          0,
          0,
          0,
          0,
          0,
          0,
          0,
          0,
          0,
          0,
          0
        ],
        "fanEfficiency": [
          1,
          0.79,
          1,
          1,
          1,
          1,
          1,
          1,
          1,
          1,
          1,
          1,
          1,
          1,
          1,
          1,
          1,
          1,
          1,
          1,
          1,
          1,
          1,
          1,
          1,
          1,
          1,
          1,
          1,
          1,
          1,
          1,
          1,
          1,
          1,
          1,
          1,
          1,
          1,
          1,
          1,
          1
        ]
      },
      "onnxParity": {
        "samples": 2,
        "rawFlowMaxAbs": 0.0,
        "flowMaxAbs": 0.0,
        "pressureMaxAbs": 0.0,
        "flowTolerance": 0.001,
        "pressureTolerance": 0.05,
        "runtime": "ONNX Runtime 1.29.0 CPU",
        "singleSamplePassed": true
      },
      "trainingSeed": 20261112,
      "bestEpoch": 350,
      "validationLoss": 1.1835630175482947e-05,
      "architecture": {
        "hidden": 128,
        "steps": 4
      },
      "trainingCaseIds": [
        "room-pillar"
      ]
    }
  ],
  "diagnosticCheckpoints": [],
  "implementationAtExport": {
    "data-pipeline/aerovia_pipeline/surrogate_data.py": {
      "sha256": "5e01eb5945184d49838e3669b82dbcbb95ccdf3eb708ade86d52d8e65bc81835",
      "bytes": 16115
    },
    "data-pipeline/aerovia_pipeline/surrogate_diagnostics.py": {
      "sha256": "086c884b304eea62d19ed061dce685f50e9b205d00a0cbe5d98a3affa7fc3194",
      "bytes": 5607
    },
    "data-pipeline/aerovia_pipeline/surrogate_evaluate.py": {
      "sha256": "8c15bce9c0d5f0e43250d160cfb4ac75d26cb6432efed94d10b878abca49c2d3",
      "bytes": 9757
    },
    "data-pipeline/aerovia_pipeline/surrogate_export.py": {
      "sha256": "5104d08786a71731f4085451ec898e0ad812be5b25d90cdb3d2b1340cd036534",
      "bytes": 17746
    },
    "data-pipeline/aerovia_pipeline/surrogate_models.py": {
      "sha256": "851e10670f86298df159b209e8bbfdb58eaa323c8797b456da7fefd4bcef0af8",
      "bytes": 4239
    },
    "data-pipeline/aerovia_pipeline/surrogate_train.py": {
      "sha256": "f2982b98cf0cff8aa2ed06239b3cf64c887e9d558963d82874d00951b4edf390",
      "bytes": 13452
    },